{
  "capability_governance": {
    "content_digest": "sha256:f5c442290ea354d558dd251932c712aa210b2fb6b568855f078332b1cdf87b9a",
    "entries": [{
      "capability_content_digest": "sha256:d294d108015f6c6e2447f1820b720d4ad5d67b68466536c399627fd1e0e6ab41",
      "capability_id": "technical.gestational-age.naegele",
      "capability_version": "1.0.0",
      "concept_bindings": [{
        "concept_content_digest": "sha256:49184207e9f5f03ef6792e2355f53e2f6ffad036caafa182c47278006243e2a6",
        "concept_id": "clinical.lmp_date",
        "concept_version": "1.0.0",
        "direction": "input",
        "parameter_name": "lmp_date"
      }],
      "content_digest": "sha256:43bd5d2c5996bb621b0f44bc75ecf711eed0b9ba568222b967c99440a27619e9",
      "evidence_sources": [{"location": "capabilities:naegele", "source_id": "SYNTHETIC_TEST_POLICY"}],
      "invocation_policy_ref": "invocation.synthetic-test@1.0.0",
      "lifecycle_state": "approved",
      "owner_roles": ["synthetic-test-clinical-owner", "synthetic-test-technical-owner"],
      "review_requirements": ["clinical", "data_governance", "technical"]
    }],
    "schema_version": "capability-governance@1.0.0"
  },
  "capability_registry": {
    "capabilities": [{
      "content_digest": "sha256:d294d108015f6c6e2447f1820b720d4ad5d67b68466536c399627fd1e0e6ab41",
      "determinism": "deterministic",
      "evidence_status": "tracer_enabled",
      "family": "calendar_arithmetic",
      "id": "technical.gestational-age.naegele",
      "implementation_binding": {
        "cht_extension_module": "gestational-age-from-lmp.js",
        "kind": "python_cht_extension",
        "python_module": "chw_navigator.special_functions",
        "python_symbol": "calculate_gestational_age_naegele"
      },
      "inputs": [
        {"cardinality": "required", "name": "lmp_date", "type": "date", "unit": "calendar_date"},
        {"cardinality": "required", "name": "reference_date", "type": "date", "unit": "calendar_date"}
      ],
      "operation": "gestational_age_and_estimated_delivery_date",
      "outputs": [
        {"binding_path": "technical.ga_weeks", "name": "ga_weeks", "type": "integer", "unit": "completed_weeks"},
        {"binding_path": "technical.ga_days_remainder", "name": "ga_days_remainder", "type": "integer", "unit": "days"},
        {"binding_path": "technical.edd", "name": "edd", "type": "date", "unit": "calendar_date"}
      ],
      "rounding": "none",
      "side_effects": [],
      "status_set": [
        "ok", "input_missing", "input_invalid", "outside_supported_domain",
        "reference_data_unavailable", "numeric_failure", "version_mismatch", "execution_failure"
      ],
      "subject_scope": "current_contact",
      "supported_domain": {
        "basis": "elapsed_days_from_lmp_to_reference_date", "maximum": 314, "minimum": 0, "unit": "days"
      },
      "supported_target_profiles": ["cht-core-5.2@1.0.0"],
      "version": "1.0.0"
    }],
    "content_digest": "sha256:71e9c68159a07e156f169d81b4b4c0b463f16b0c78cbd1db585469bc65b9bfa4",
    "schema_version": "capability-registry@1.0.0"
  },
  "content_digest": "sha256:6d4422f8e90fe7b7137e3b546e57f31b2082046cd8ca6f8da5664df978fb3e23",
  "data_dictionary": {
    "concepts": [{
      "access_policy_ref": "access.synthetic-test@1.0.0",
      "cardinality": "optional",
      "consent_policy_ref": "consent.synthetic-test@1.0.0",
      "content_digest": "sha256:49184207e9f5f03ef6792e2355f53e2f6ffad036caafa182c47278006243e2a6",
      "data_owner_role": "synthetic-test-data-steward",
      "definition": "First day of the most recently recorded last menstrual period.",
      "id": "clinical.lmp_date",
      "identifiers": [{"code": "LMP_DATE", "system": "synthetic-test-concepts"}],
      "interoperability_mappings": [],
      "lifecycle_state": "approved",
      "provenance": [{"location": "concepts:lmp_date", "source_id": "SYNTHETIC_TEST_POLICY"}],
      "requiredness": "conditional",
      "retention_policy_ref": "retention.synthetic-test@1.0.0",
      "type": "date",
      "unit": "calendar_date",
      "value_set": [],
      "version": "1.0.0"
    }],
    "content_digest": "sha256:a85b31fbadea680af950fa1940ac9fd3e8d339e1f4a317c889fb6380ac5eea7c",
    "schema_version": "data-dictionary@1.0.0"
  },
  "schema_version": "registry-set@2.0.0",
  "target_profile": {
    "cht_conf_version": "6.4.1",
    "cht_core_version": "5.2.0",
    "content_digest": "sha256:14f72cd11f189319df9ac2395231d324d2d9b83da46ab7713259c13e2a4a0e0b",
    "extension_support": {"extension_lib_expression": true, "extension_lib_xpath": true},
    "form_engine": {"name": "cht-form-runner", "version": "4.11.0"},
    "id": "cht-core-5.2",
    "required_local_data_features": [
      "contact_summary", "registered_local_read", "latest_value_ordering", "recorded_at_freshness"
    ],
    "schema_version": "target-profile@1.0.0",
    "version": "1.0.0"
  }
}
